{
  "id": 356,
  "menuDate": "2019-12-19T00:00:00",
  "restaurantId": 4,
  "chefId": 0,
  "description": null,
  "approvedById": 0,
  "approvedDateTime": "0001-01-01T00:00:00",
  "approved": false,
  "requestToBeApproved": false,
  "remark": null,
  "menuItems": [
    {
      "id": 2340,
      "nameNl": null,
      "nameEn": null,
      "menuTypeId": 0,
      "chefId": 0,
      "enabled": 1,
      "remark": null,
      "menuid": 356,
      "sortorder": 0,
      "menuItemContents": [
        {
          "id": 3374,
          "menuItemId": 2340,
          "courseId": 5575,
          "sortOrder": 0,
          "course": {
            "id": 5575,
            "dispNameNl": "Zilt knolseldersoepje met zeekraal",
            "dispNameEn": "silt celeriac soup with salicorn",
            "nameNl": "Zilt knolseldersoepje met zeekraal, vegan",
            "nameEn": "",
            "weight": "",
            "extra": "",
            "preparation": "Stoof de ui aan, samen met de prei en de knolselder in boter. Bevochtig daarna met de bouillon en laat zachtjes koken tot de groenten gaar zijn. Werk af met de kervel en de zeekraal.",
            "price": 0.9,
            "photo": "",
            "isCourse": true,
            "isIngredient": true,
            "course_CategoryForCourses": null,
            "course_Allergens": [
              {
                "courseId": 5575,
                "allergenId": 201
              },
              {
                "courseId": 5575,
                "allergenId": 208
              },
              {
                "courseId": 5575,
                "allergenId": 210
              }
            ],
            "course_CourseLogos": [
              {
                "courseId": 5575,
                "courseLogoId": 211
              },
              {
                "courseId": 5575,
                "courseLogoId": 213
              }
            ],
            "maincourse": true,
            "menuInfo": "",
            "fixedMultiplePrices": false,
            "calculatedMultiplePrices": false,
            "fixedprice": true,
            "showFirst": false,
            "deleted": false,
            "enabled": true,
            "menuInfoEn": null
          }
        }
      ]
    },
    {
      "id": 2431,
      "nameNl": null,
      "nameEn": null,
      "menuTypeId": 0,
      "chefId": 0,
      "enabled": 1,
      "remark": null,
      "menuid": 356,
      "sortorder": 1,
      "menuItemContents": [
        {
          "id": 3488,
          "menuItemId": 2431,
          "courseId": 5586,
          "sortOrder": 0,
          "course": {
            "id": 5586,
            "dispNameNl": "Pasta met soja-bolognaisesaus",
            "dispNameEn": "Pasta with soy bolognaise sauce",
            "nameNl": "Pasta met soja-bolognaisesaus",
            "nameEn": "",
            "weight": "",
            "extra": "",
            "preparation": "",
            "price": 3.8,
            "photo": "",
            "isCourse": true,
            "isIngredient": true,
            "course_CategoryForCourses": null,
            "course_Allergens": [
              {
                "courseId": 5586,
                "allergenId": 200
              },
              {
                "courseId": 5586,
                "allergenId": 201
              },
              {
                "courseId": 5586,
                "allergenId": 208
              },
              {
                "courseId": 5586,
                "allergenId": 210
              }
            ],
            "course_CourseLogos": [
              {
                "courseId": 5586,
                "courseLogoId": 207
              },
              {
                "courseId": 5586,
                "courseLogoId": 214
              }
            ],
            "maincourse": true,
            "menuInfo": "",
            "fixedMultiplePrices": false,
            "calculatedMultiplePrices": true,
            "fixedprice": false,
            "showFirst": false,
            "deleted": false,
            "enabled": true,
            "menuInfoEn": null
          }
        }
      ]
    },
    {
      "id": 2341,
      "nameNl": null,
      "nameEn": null,
      "menuTypeId": 0,
      "chefId": 0,
      "enabled": 1,
      "remark": null,
      "menuid": 356,
      "sortorder": 2,
      "menuItemContents": [
        {
          "id": 3375,
          "menuItemId": 2341,
          "courseId": 3141,
          "sortOrder": 0,
          "course": {
            "id": 3141,
            "dispNameNl": "Croissant met brie",
            "dispNameEn": "Croissant with brie",
            "nameNl": "croissant brie, w",
            "nameEn": "",
            "weight": "250g",
            "extra": "koel bewaren - veggie",
            "preparation": "amandelschilfers roosteren",
            "price": 2.3,
            "photo": "",
            "isCourse": false,
            "isIngredient": false,
            "course_CategoryForCourses": null,
            "course_Allergens": [
              {
                "courseId": 3141,
                "allergenId": 200
              },
              {
                "courseId": 3141,
                "allergenId": 201
              },
              {
                "courseId": 3141,
                "allergenId": 203
              },
              {
                "courseId": 3141,
                "allergenId": 205
              },
              {
                "courseId": 3141,
                "allergenId": 206
              },
              {
                "courseId": 3141,
                "allergenId": 209
              },
              {
                "courseId": 3141,
                "allergenId": 210
              }
            ],
            "course_CourseLogos": [
              {
                "courseId": 3141,
                "courseLogoId": 204
              },
              {
                "courseId": 3141,
                "courseLogoId": 210
              },
              {
                "courseId": 3141,
                "courseLogoId": 214
              }
            ],
            "maincourse": true,
            "menuInfo": null,
            "fixedMultiplePrices": false,
            "calculatedMultiplePrices": false,
            "fixedprice": true,
            "showFirst": false,
            "deleted": false,
            "enabled": true,
            "menuInfoEn": null
          }
        }
      ]
    },
    {
      "id": 2401,
      "nameNl": null,
      "nameEn": null,
      "menuTypeId": 0,
      "chefId": 0,
      "enabled": 1,
      "remark": null,
      "menuid": 356,
      "sortorder": 3,
      "menuItemContents": [
        {
          "id": 3451,
          "menuItemId": 2401,
          "courseId": 1890,
          "sortOrder": 0,
          "course": {
            "id": 1890,
            "dispNameNl": "Salade zonder sla",
            "dispNameEn": "Salad without lettuce",
            "nameNl": "salade slaatje zonder sla (aardappel, appel, raapjes), dd, w",
            "nameEn": "",
            "weight": "300g",
            "extra": "koel bewaren - veggie",
            "preparation": "scharrelei gekookt rico 75st of scharrelei gekookt rico 6x12st karton appel besprenkelen met citroensap",
            "price": 3.8,
            "photo": "",
            "isCourse": false,
            "isIngredient": false,
            "course_CategoryForCourses": null,
            "course_Allergens": [
              {
                "courseId": 1890,
                "allergenId": 200
              },
              {
                "courseId": 1890,
                "allergenId": 203
              },
              {
                "courseId": 1890,
                "allergenId": 205
              },
              {
                "courseId": 1890,
                "allergenId": 206
              },
              {
                "courseId": 1890,
                "allergenId": 208
              },
              {
                "courseId": 1890,
                "allergenId": 209
              },
              {
                "courseId": 1890,
                "allergenId": 212
              }
            ],
            "course_CourseLogos": [
              {
                "courseId": 1890,
                "courseLogoId": 209
              },
              {
                "courseId": 1890,
                "courseLogoId": 214
              }
            ],
            "maincourse": true,
            "menuInfo": null,
            "fixedMultiplePrices": false,
            "calculatedMultiplePrices": true,
            "fixedprice": false,
            "showFirst": false,
            "deleted": false,
            "enabled": true,
            "menuInfoEn": null
          }
        }
      ]
    }
  ],
  "$schema": "./raw.schema.json"
}